{"contract_version":"v1","change_id":"change_v1_01J8Q3Z4R5T6V7W8X9Y0ABCDEF","definition_id":"definition_v1_01J8Q3Z4R5T6V7W8X9Y0ABCDEF","workflow_id":"workflow_v1_01J8Q3Z4R5T6V7W8X9Y0ABCDEF","request_id":"request_v1_01J8Q3Z4R5T6V7W8X9Y0ABCDEF","trace_id":"trace_v1_01J8Q3Z4R5T6V7W8X9Y0ABCDEF","action":"activate","expected_lifecycle":"inactive","expected_revision":4,"approval_ref":"approval_v1_01J8Q3Z4R5T6V7W8X9Y0ABCDEF","idempotency_key":"n8n-request-01J8Q3Z4R5T6V7W8X9Y0ABCDEF"}
